{
  "version": "1.0.0",
  "manifestVersion": 1,
  "generatedAt": "2026-10-18T15:34:18.376Z",
  "sources": [
    {
      "id": "src-apple-specs",
      "name": "Apple Hardware Technical Specifications",
      "sourceType": "MANUFACTURER",
      "status": "ACTIVE",
      "publisher": "Apple Inc.",
      "url": "https://support.apple.com/specs",
      "license": "Public Product Specifications (Fair Use Reference)",
      "version": "2026.1",
      "checksum": "sha256-apple-specs-20260101",
      "isSynthetic": false
    },
    {
      "id": "src-dell-specs",
      "name": "Dell XPS & Latitude Technical Specs",
      "sourceType": "MANUFACTURER",
      "status": "ACTIVE",
      "publisher": "Dell Technologies",
      "url": "https://www.dell.com/specs",
      "license": "Public Product Specifications (Fair Use Reference)",
      "version": "2026.1",
      "checksum": "sha256-dell-specs-20260101",
      "isSynthetic": false
    },
    {
      "id": "src-lenovo-specs",
      "name": "Lenovo ThinkPad & Legion PSREF Specs",
      "sourceType": "MANUFACTURER",
      "status": "ACTIVE",
      "publisher": "Lenovo Group",
      "url": "https://psref.lenovo.com",
      "license": "Public PSREF Documentation (Reference)",
      "version": "2026.1",
      "checksum": "sha256-lenovo-specs-20260101",
      "isSynthetic": false
    },
    {
      "id": "src-samsung-specs",
      "name": "Samsung Galaxy Hardware Specifications",
      "sourceType": "MANUFACTURER",
      "status": "ACTIVE",
      "publisher": "Samsung Electronics",
      "url": "https://www.samsung.com/global/galaxy",
      "license": "Public Technical Specifications (Fair Use Reference)",
      "version": "2026.1",
      "checksum": "sha256-samsung-specs-20260101",
      "isSynthetic": false
    },
    {
      "id": "src-anker-specs",
      "name": "Anker Power & Charging Specifications",
      "sourceType": "MANUFACTURER",
      "status": "ACTIVE",
      "publisher": "Anker Innovations",
      "url": "https://www.anker.com/specs",
      "license": "Public Technical Documentation (Reference)",
      "version": "2026.1",
      "checksum": "sha256-anker-specs-20260101",
      "isSynthetic": false
    },
    {
      "id": "src-sony-specs",
      "name": "Sony Audio & Peripheral Specifications",
      "sourceType": "MANUFACTURER",
      "status": "ACTIVE",
      "publisher": "Sony Group",
      "url": "https://www.sony.com/electronics/specs",
      "license": "Public Hardware Specifications (Reference)",
      "version": "2026.1",
      "checksum": "sha256-sony-specs-20260101",
      "isSynthetic": false
    },
    {
      "id": "src-asus-specs",
      "name": "ASUS ROG & Zenbook Hardware Specifications",
      "sourceType": "MANUFACTURER",
      "status": "ACTIVE",
      "publisher": "ASUS TeK Computer",
      "url": "https://www.asus.com/specs",
      "license": "Public Hardware Documentation (Reference)",
      "version": "2026.1",
      "checksum": "sha256-asus-specs-20260101",
      "isSynthetic": false
    },
    {
      "id": "src-logitech-specs",
      "name": "Logitech Peripherals Technical Specs",
      "sourceType": "MANUFACTURER",
      "status": "ACTIVE",
      "publisher": "Logitech International",
      "url": "https://www.logitech.com/specs",
      "license": "Public Technical Specifications (Reference)",
      "version": "2026.1",
      "checksum": "sha256-logitech-specs-20260101",
      "isSynthetic": false
    }
  ],
  "brands": [
    {
      "id": "brand-apple",
      "name": "Apple",
      "slug": "apple",
      "country": "United States",
      "websiteUrl": "https://www.apple.com",
      "isActive": true
    },
    {
      "id": "brand-dell",
      "name": "Dell",
      "slug": "dell",
      "country": "United States",
      "websiteUrl": "https://www.dell.com",
      "isActive": true
    },
    {
      "id": "brand-lenovo",
      "name": "Lenovo",
      "slug": "lenovo",
      "country": "China",
      "websiteUrl": "https://www.lenovo.com",
      "isActive": true
    },
    {
      "id": "brand-samsung",
      "name": "Samsung",
      "slug": "samsung",
      "country": "South Korea",
      "websiteUrl": "https://www.samsung.com",
      "isActive": true
    },
    {
      "id": "brand-anker",
      "name": "Anker",
      "slug": "anker",
      "country": "China",
      "websiteUrl": "https://www.anker.com",
      "isActive": true
    },
    {
      "id": "brand-sony",
      "name": "Sony",
      "slug": "sony",
      "country": "Japan",
      "websiteUrl": "https://www.sony.com",
      "isActive": true
    },
    {
      "id": "brand-asus",
      "name": "ASUS",
      "slug": "asus",
      "country": "Taiwan",
      "websiteUrl": "https://www.asus.com",
      "isActive": true
    },
    {
      "id": "brand-logitech",
      "name": "Logitech",
      "slug": "logitech",
      "country": "Switzerland",
      "websiteUrl": "https://www.logitech.com",
      "isActive": true
    }
  ],
  "categories": [
    {
      "id": "cat-laptop",
      "name": "Laptop & Máy tính xách tay",
      "slug": "laptop",
      "kind": "LAPTOP",
      "specSchemaVersion": 1,
      "warrantyConfig": {
        "policyType": "OFFICIAL",
        "periodMonths": 12,
        "provider": "MANUFACTURER"
      },
      "isActive": true,
      "specSchema": {
        "schemaVersion": 1,
        "definitions": [
          {
            "code": "cpu",
            "label": "Vi xử lý (CPU)",
            "valueType": "TEXT",
            "required": true,
            "filterable": true,
            "comparable": true
          },
          {
            "code": "ram",
            "label": "Bộ nhớ RAM",
            "valueType": "INTEGER",
            "unit": "GB",
            "required": true,
            "filterable": true,
            "comparable": true
          },
          {
            "code": "ssd",
            "label": "Ổ cứng SSD",
            "valueType": "INTEGER",
            "unit": "GB",
            "required": true,
            "filterable": true,
            "comparable": true
          },
          {
            "code": "display_size",
            "label": "Màn hình",
            "valueType": "DECIMAL",
            "unit": "inch",
            "required": true,
            "filterable": true,
            "comparable": true
          },
          {
            "code": "resolution",
            "label": "Độ phân giải",
            "valueType": "TEXT",
            "required": true,
            "comparable": true
          },
          {
            "code": "refresh_rate",
            "label": "Tần số quét",
            "valueType": "INTEGER",
            "unit": "Hz",
            "comparable": true
          },
          {
            "code": "weight",
            "label": "Trọng lượng",
            "valueType": "DECIMAL",
            "unit": "kg",
            "comparable": true
          },
          {
            "code": "os",
            "label": "Hệ điều hành",
            "valueType": "TEXT",
            "filterable": true,
            "comparable": true
          },
          {
            "code": "nfc",
            "label": "Kết nối NFC",
            "valueType": "BOOLEAN",
            "allowUnsupported": true,
            "comparable": true
          }
        ],
        "variantOptions": [
          {
            "code": "color",
            "label": "Màu sắc",
            "valueType": "TEXT"
          },
          {
            "code": "ram",
            "label": "RAM",
            "valueType": "INTEGER",
            "unit": "GB"
          },
          {
            "code": "ssd",
            "label": "SSD",
            "valueType": "INTEGER",
            "unit": "GB"
          }
        ]
      }
    },
    {
      "id": "cat-smartphone",
      "name": "Điện thoại thông minh",
      "slug": "smartphone",
      "kind": "PHONE",
      "specSchemaVersion": 1,
      "warrantyConfig": {
        "policyType": "OFFICIAL",
        "periodMonths": 12,
        "provider": "MANUFACTURER"
      },
      "isActive": true,
      "specSchema": {
        "schemaVersion": 1,
        "definitions": [
          {
            "code": "chipset",
            "label": "Vi xử lý (Chipset)",
            "valueType": "TEXT",
            "required": true,
            "filterable": true,
            "comparable": true
          },
          {
            "code": "ram",
            "label": "Bộ nhớ RAM",
            "valueType": "INTEGER",
            "unit": "GB",
            "required": true,
            "filterable": true,
            "comparable": true
          },
          {
            "code": "storage",
            "label": "Bộ nhớ trong",
            "valueType": "INTEGER",
            "unit": "GB",
            "required": true,
            "filterable": true,
            "comparable": true
          },
          {
            "code": "screen_size",
            "label": "Màn hình",
            "valueType": "DECIMAL",
            "unit": "inch",
            "required": true,
            "filterable": true,
            "comparable": true
          },
          {
            "code": "battery_capacity",
            "label": "Dung lượng pin",
            "valueType": "INTEGER",
            "unit": "mAh",
            "comparable": true
          },
          {
            "code": "camera_main",
            "label": "Camera chính",
            "valueType": "INTEGER",
            "unit": "MP",
            "comparable": true
          },
          {
            "code": "is_5g",
            "label": "Hỗ trợ 5G",
            "valueType": "BOOLEAN",
            "filterable": true,
            "comparable": true
          },
          {
            "code": "os",
            "label": "Hệ điều hành",
            "valueType": "TEXT",
            "filterable": true,
            "comparable": true
          },
          {
            "code": "nfc",
            "label": "Giao tiếp NFC",
            "valueType": "BOOLEAN",
            "comparable": true
          }
        ],